{
    "last_updated": "2023-07-17T13:34:13+02:00",
    "ttl": 300,
    "version": "3.1-RC",
    "data": {
        "stations": [
            {
                "station_id": "station12",
                "name": [
                    {
                        "text": "SE Belmont & SE 10th",
                        "language": "en"
                    }
                ],
                "lat": 45.516445,
                "lon": -122.655775,
                "city": "Portland, OR",
                "is_valet_station": false,
                "is_virtual_station": true,
                "is_charging_station": false,
                "station_area": {
                    "type": "MultiPolygon",
                    "coordinates": [
                        [
                            [
                                [
                                    -122.655775,
                                    45.516445
                                ],
                                [
                                    -122.655705,
                                    45.516445
                                ],
                                [
                                    -122.655705,
                                    45.516495
                                ],
                                [
                                    -122.655775,
                                    45.516495
                                ],
                                [
                                    -122.655775,
                                    45.516445
                                ]
                            ]
                        ]
                    ]
                },
                "capacity": 16,
                "vehicle_types_capacity": [
                    {
                        "vehicle_type_ids": [
                            "abc123",
                            "def456"
                        ],
                        "count": 15
                    },
                    {
                        "vehicle_type_ids": [
                            "def456"
                        ],
                        "count": 1
                    }
                ]
            }
        ]
    }
}